{
  "schema_version": 1,
  "registry_id": "atm-invariants/v1",
  "scope": "System invariants already enforced by the current AtM baseline; future v1 invariants are added by the PR that implements them.",
  "qualification_policy": {
    "blocking_severities": [
      "S0",
      "S1"
    ],
    "scoring": "none"
  },
  "invariants": [
    {
      "id": "STARTUP-S0-001",
      "category": "STARTUP",
      "severity": "S0",
      "lifecycle": "enforced",
      "statement": "Startup qualification must fail closed when the Flatpak application/runtime identity required by the current qualification policy cannot be established.",
      "enforced_by": [
        "src/startup_qualification.c",
        "src/StartupQualificationService.vala"
      ],
      "tested_by": [
        "meson:startup-qualification",
        "meson:startup-qualification-service"
      ]
    },
    {
      "id": "REPOSITORY-S0-001",
      "category": "REPOSITORY",
      "severity": "S0",
      "lifecycle": "enforced",
      "statement": "Invalid persisted repository state must not be overwritten or repaired implicitly by normal repository-state mutations.",
      "enforced_by": [
        "src/RepositoryState.vala"
      ],
      "tested_by": [
        "meson:repository-state"
      ]
    },
    {
      "id": "REPOSITORY-S0-002",
      "category": "REPOSITORY",
      "severity": "S0",
      "lifecycle": "enforced",
      "statement": "A persisted repository snapshot may be reported ready only when the snapshot path is bound to the persisted SHA, manifest identity validates, the repository version matches, and the retrieval index is valid or is rebuilt from that same snapshot.",
      "enforced_by": [
        "src/repository_reconcile.c",
        "src/retrieval_index_lifecycle.c"
      ],
      "tested_by": [
        "meson:repository-reconcile",
        "meson:retrieval-index-lifecycle"
      ]
    },
    {
      "id": "REPOSITORY-S0-003",
      "category": "REPOSITORY",
      "severity": "S0",
      "lifecycle": "enforced",
      "statement": "A repository snapshot whose integrity seal no longer matches its contents must not remain usable as ready current state.",
      "enforced_by": [
        "src/snapshot_seal.c",
        "src/RepositoryLifecycleService.vala"
      ],
      "tested_by": [
        "meson:snapshot-seal",
        "meson:repository-lifecycle-service"
      ]
    },
    {
      "id": "REPOSITORY-S0-004",
      "category": "REPOSITORY",
      "severity": "S0",
      "lifecycle": "enforced",
      "statement": "When a repository Download/Update operation snapshots optimization mode ON, it must acquire one application-owned exclusive nonblocking repository mutation lease before any selected-repository staging or authority mutation and hold it through filesystem preparation, guarded Control DB commit and operation cleanup. Contention must fail before deterministic staging is touched; the lease must not replace guarded Control DB generation checks, and ordinary read-only grounding must not require the global authority lease.",
      "enforced_by": [
        "src/repository_mutation_lease.c",
        "src/repository_mutation_lease.h",
        "src/RepositoryNative.vala",
        "src/RepositoryLifecycleService.vala"
      ],
      "tested_by": [
        "meson:repository-mutation-lease",
        "meson:repository-lifecycle-service"
      ]
    },
    {
      "id": "INGEST-S0-001",
      "category": "INGEST",
      "severity": "S0",
      "lifecycle": "enforced",
      "statement": "Repository archive ingestion must enforce bounded extraction and reject unsafe paths or link-like archive entries before a snapshot can be promoted.",
      "enforced_by": [
        "src/archive_extract.c",
        "src/repository_ingest.c"
      ],
      "tested_by": [
        "meson:archive-extract",
        "meson:repository-ingest"
      ]
    },
    {
      "id": "RETRIEVAL-S0-001",
      "category": "RETRIEVAL",
      "severity": "S0",
      "lifecycle": "enforced",
      "statement": "When a retrieval-index ensure operation snapshots Optimizations ON and the exact final index is not already valid, cooperative AtM processes must coordinate one exclusive per-repository-SHA build flight under the qualified state root. A waiter must revalidate the final index after acquiring the flight and return the completed artifact when valid; only the flight owner may remove an invalid final index or a regular abandoned deterministic staging file. Non-regular staging and unqualified coordination paths must fail closed. Optimizations OFF must retain the baseline retrieval-index lifecycle.",
      "enforced_by": [
        "src/coordination_lease.c",
        "src/coordination_lease.h",
        "src/retrieval_index_lifecycle.c",
        "src/repository_ui_bridge.c",
        "src/RepositoryLifecycleService.vala"
      ],
      "tested_by": [
        "meson:retrieval-index-lifecycle",
        "meson:repository-lifecycle-service"
      ]
    },
    {
      "id": "RETRIEVAL-S1-001",
      "category": "RETRIEVAL",
      "severity": "S1",
      "lifecycle": "enforced",
      "statement": "A retrieval index may be reused only when it validates against the exact repository and snapshot sources; an invalid derived index must be rejected and rebuilt or surface an error.",
      "enforced_by": [
        "src/retrieval_index_lifecycle.c",
        "src/retrieval_index.c"
      ],
      "tested_by": [
        "meson:retrieval-index-lifecycle",
        "meson:repository-reconcile"
      ]
    },
    {
      "id": "SESSION-S0-001",
      "category": "SESSION",
      "severity": "S0",
      "lifecycle": "enforced",
      "statement": "A conversation session may start only from frozen grounding and must keep the selected AI model identity, including its digest when available, pinned until the session is reset.",
      "enforced_by": [
        "src/ConversationSession.vala",
        "src/ConversationGrounding.vala"
      ],
      "tested_by": [
        "meson:conversation-session"
      ]
    },
    {
      "id": "RETRIEVAL-S1-002",
      "category": "RETRIEVAL",
      "severity": "S1",
      "lifecycle": "enforced",
      "statement": "The same logical evidence object must expose the same structured semantic metadata regardless of whether it is discovered by exact, lexical, or tabular retrieval.",
      "enforced_by": [
        "src/retrieval_query.h",
        "src/retrieval_query.c"
      ],
      "tested_by": [
        "meson:retrieval-query"
      ]
    },
    {
      "id": "SCIENTIFIC-S0-001",
      "category": "SCIENTIFIC",
      "severity": "S0",
      "lifecycle": "enforced",
      "statement": "Only an explicit frozen AtM scientific profile rule matching the evidence repository and structural selector may produce TYPED_VALIDATED; repository payload text cannot grant itself scientific authority.",
      "enforced_by": [
        "src/scientific_profile.c",
        "src/scientific_evidence.c"
      ],
      "tested_by": [
        "meson:scientific-evidence"
      ]
    },
    {
      "id": "SCIENTIFIC-S0-002",
      "category": "SCIENTIFIC",
      "severity": "S0",
      "lifecycle": "enforced",
      "statement": "Textual, unsupported, provenance-incomplete, or profile-recognized malformed evidence must fail closed as a non-typed scientific classification and must never be silently promoted to TYPED_VALIDATED.",
      "enforced_by": [
        "src/scientific_evidence.c"
      ],
      "tested_by": [
        "meson:scientific-evidence"
      ]
    },
    {
      "id": "SCIENTIFIC-S1-003",
      "category": "SCIENTIFIC",
      "severity": "S1",
      "lifecycle": "enforced",
      "statement": "The EWD, CBD, and RMD v1 production profile factories are deny-by-default allowlists: only explicitly declared structural selectors and exact dataset logical source IDs may be recognized, and unlisted or near-match evidence remains unsupported.",
      "enforced_by": [
        "src/scientific_profile_ewd.c",
        "src/scientific_profile_cbd.c",
        "src/scientific_profile_rmd.c"
      ],
      "tested_by": [
        "meson:scientific-profiles"
      ]
    },
    {
      "id": "SCIENTIFIC-S0-004",
      "category": "SCIENTIFIC",
      "severity": "S0",
      "lifecycle": "enforced",
      "statement": "Scientific control evidence must be read only through AtM-owned fixed repository/path/JSON-Pointer/type specifications from the pinned snapshot, without retrieval or textual fallback; unsafe paths, symlink traversal, unresolved pointers and type mismatches must fail closed.",
      "enforced_by": [
        "src/scientific_control.c",
        "src/json_pointer.c"
      ],
      "tested_by": [
        "meson:scientific-control"
      ]
    },
    {
      "id": "SCIENTIFIC-S0-005",
      "category": "SCIENTIFIC",
      "severity": "S0",
      "lifecycle": "enforced",
      "statement": "SCI-04 must keep ScientificContentId, QualifiedArtifactId, and StorageDigest distinct: semantic content is canonically identified independently of storage/provenance, qualification binds that content to pinned provenance and semantic-profile identity, and storage digest covers the complete stored artifact; only TYPED_VALIDATED evidence or recognized deterministic controls may enter the artifact layer, and mutation or incomplete provenance must fail validation.",
      "enforced_by": [
        "src/scientific_canonical.c",
        "src/scientific_artifact.c"
      ],
      "tested_by": [
        "meson:scientific-canonical",
        "meson:scientific-artifact"
      ]
    },
    {
      "id": "SCIENTIFIC-S0-006",
      "category": "SCIENTIFIC",
      "severity": "S0",
      "lifecycle": "enforced",